user_input,retrieved_contexts,response,reference,faithfulness,answer_relevancy,context_precision,context_recall
What happened to the PCRF income starting in FY24?,"[""those currently anticipated. IFC undertakes no obligation to update any forward-looking statements. Certain reclassifications of prior years' information have been made to conform with the current year's presentation.\nTable 1: Selected Financial Data\na. Starting FY23, short-term finance core mobilization commitments were included in commitments reporting. Previous year's information was updated to conform with the current year's presentation.\nb. Starting FY24, the Post-retirement Contribution Reserve Fund (PCRF) income was excluded from Income Available for Designations. Please refer to Section II: Basis of preparation of IFC's consolidated financial statements for more details.\nc. Net of securities sold under repurchase agreements, payable for cash collateral received and associated derivatives.\nSECTION l. EXECUTIVE SUMMARY\nThis executive summary highlights selected information and may not contain all of the information that is important to readers of this document. For a complete description of IFC's FY24 performance, as well as the risks and critical accounting estimates affecting IFC, this MD&A should be read in its entirety."", ""as firms addressing climate change. On July 1, 2024, the WBG guarantee platform, housed at MIGA, was launched to bring together products and experts from the World Bank, IFC, and MIGA and aims to boost WBG annual guarantee issuances for all entities.\nFINANCIAL PERFORMANCE SUMMARY\nIFC's financial performance has been influenced by the changes in interest rates in FY24.\nNET INCOME AND INCOME AVAILABLE FOR DESIGNATIONS\nIFC's net income was $1.5 billion in FY24, as compared to net income of $672 million in FY23. Income Available for Designations totaled $1.6 billion in FY24, as compared to an income of $681 million in FY23. Starting in FY24, the Post-retirement Contribution Reserve Fund (PCRF) income is excluded from Income Available for Designations. See Section II: Basis of preparation of IFC's consolidated financial statements for more details. The increase in Net Income and Income Available for Designations was mainly driven by higher treasury income and strong net interest income on loans and debt securities in FY24.\nINVESTMENT OPERATIONS"", ""te A to IFC's consolidated financial statements as of and for the year ended June 30, 2024 (FY24 consolidated financial statements). Certain reclassifications of prior years' information have been made to conform with the current year's presentation.\nIFC uses Income Available for Designations (a non-U.S. GAAP measure) as a basis for designations of retained earnings. Prior to FY24, Income Available for Designations comprise net income excluding unrealized gains and losses on investments and borrowings 3 as well as grants to IDA, which were suspended in FY20 following the conclusion of the IDA Eighteen Replenishment of Resources (IDA18). In FY24, IFC updated the calculation of Income Available for Designations to exclude income from Post-retirement Contribution Reserve Fund (PCRF), aligning it with its intended use for post-retirement contributions. This change, approved by the Board in June 2024, is effective from FY24 and is reflected in the table below.\nTable 2: Reconciliation of Net Income or Loss to Income Available for Designations"", ""30, 2024, mainly due to net new issuances of $3.7 billion.\nNew borrowings under the medium- and long-term borrowing program (on a funding authorization basis) in FY24 were $13.1 billion as compared to $13.7 billion in FY23.\nECONOMIC CAPITAL FRAMEWORK\nIFC's Capital Adequacy, as measured by CUR stood at 60.5 percent as of June 30, 2024, slightly lower than the 60.7 percent as of June 30, 2023. The reduction (lower capital utilization) in CUR was largely attributed to an increase in Capital Available, resulting from increases in undesignated retained earnings, paid-in capital, and other comprehensive income. There was also an increase in Capital Required, primarily due to the need for additional capital to support the Loan and Equity portfolios. During FY24, IFC updated its capital adequacy framework. Effective from Q3, IFC increased the granularity in economic capital calculations for trade finance, and also brought IFC's definition of Capital Available more closely into alignment with Basel Framework and S&P rating methodology by deducting the pension surplus of each pension plan. Effective from Q4, IFC excluded the PCRF assets from Capital Available, aligning with its intended use for post-retirement contributions.""]","Starting in FY24, the Post-retirement Contribution Reserve Fund (PCRF) income was excluded from Income Available for Designations, aligning it with its intended use for post-retirement contributions.","Starting in FY24, the Post-retirement Contribution Reserve Fund (PCRF) income was excluded from Income Available for Designations.",1.0,0.8035685514326368,0.999999999975,1.0
What were the main drivers for the net income increase?,"[""onsolidated financial statements for more details. The increase in Net Income and Income Available for Designations was mainly driven by higher treasury income and strong net interest income on loans and debt securities in FY24.\nINVESTMENT OPERATIONS\nIn FY24, IFC delivered a combined total of $56.1 billion in long-term and short-term financing, representing an increase of 28 percent compared to FY23. IFC committed $31.7 billion from its own account ($27.7 billion in FY23) and disbursed $19.1 billion in FY24 ($18.7 billion in FY23) excluding guarantees. See more details in Section III: Client Services.\nINVESTMENT PORTFOLIO\nThe carrying value 2 of IFC's outstanding investment portfolio was $58.7 billion as of June 30, 2024, an increase of $7.2 billion compared to June 30, 2023. The portfolio's growth primarily resulted from the $7.7 billion of net disbursements (disbursements net of repayments, prepayments, and divestments), during FY24.\nLIQUID ASSETS"", ""tween FY24 and FY23 covering the periods included in IFC's FY24 consolidated financial statements. The $813 million increase in net income was principally a result of the following:\n0 X 3\nFigure 26: Change in Net Income FY24 vs FY23\n(US$ in millions)\n* Total income from loans and debt securities and net treasury income are net of allocated charges on borrowings.\n** URG(L) refers to Unrealized Gains (Losses).\n*** Others mainly represents foreign exchange gains/losses, service fees, and net advisory service expenses.\nA more detailed analysis of the components of IFC's net income is as follows.\nINCOME FROM LOANS AND GUARANTEES, INCLUDING REALIZED GAINS AND LOSSES ON LOANS AND ASSOCIATED DERIVATIVES\nIncome from loans and guarantees, including realized gains and losses on loans and associated derivatives for FY24 amounted to $3.2 billion. This represents an increase of $914 million compared to $2.3 billion in FY23, primarily due to higher interest income from increased interest rates and portfolio growth.\nNON-PERFORMING LOANS (NPLS)"", 'million mainly driven by an increase in Advisory services income, Post-retirement Contributions Reserve Fund (PCRF) income and investment returns on Post-Employment Benefit Plan assets. The components of other income are analyzed in the table below:\nOTHER EXPENSES\nOther Expenses increased by $106 million. The increase in administrative expenses is mainly due to higher staff costs partially offset by lower pension expenses. The components of other expenses are analyzed in the table below:\nTable 25: Other Expenses\nFOREIGN CURRENCY TRANSACTION GAINS AND LOSSES ON NON-TRADING ACTIVITIES\nForeign currency transaction gains and losses are recognized in both net income and other comprehensive income. For debt securities classified as available-for-sale, the gains or losses from foreign currency transactions are reported in other comprehensive income, while the impact from the associated derivatives are reported in net income. The net foreign exchange related gains/(losses) are analyzed in the table below:\nTable 26: Foreign Currency Transaction Gains and Losses on Non-Trading Activities', 'In comparison, in FY23 the top five investments with net gains were $230 million and the top five investments with net losses were $197 million.\nINCOME FROM DEBT SECURITIES AND REALIZED GAINS AND LOSSES ON DEBT SECURITIES, AND ASSOCIATED DERIVATIVES\nIncome from debt securities and associated derivatives increased by $293 million from $518 million in FY23 to $811 million in FY24. The increase was primarily due to a $348 million increase in interest income resulting from higher outstanding balances, partially offset by a $55 million decrease in realized gains.\nINCOME FROM LIQUID ASSETS TRADING ACTIVITIES\nIncome from liquid assets trading activities gross of funding costs and net of funding costs are analyzed in the table below:\nTable 23: Income from Liquid Assets Trading Activities']","The main drivers for the increase in Net Income were higher treasury income and strong net interest income on loans and debt securities in FY24. Specifically, income from loans and guarantees increased due to higher interest rates and portfolio growth, and income from debt securities increased primarily due to higher outstanding balances.",The increase in Net Income was principally driven by higher treasury investment returns and advisory services income.,1.0,0.7210510501814122,0.3333333333,1.0
What strategies is the organization deploying to modernize its framework?,"[""financing plan. Mobilization activities are included in Core Mobilization if they meet five criteria:\nThe Procedure provides product-specific frameworks for interventions to qualify as Core Mobilization. These include:\nINVESTMENT PORTFOLIO MANAGEMENT\nAt the core of IFC's approach to portfolio management is the objective to build and proactively manage a portfolio that produces strong financial results and development impact. IFC achieves this through a combination of strong presence on the ground and deep sector expertise, that enables IFC to stay close to its clients and markets, monitor trends and anticipate impacts of external factors."", ""om IBRD, IDA, MIGA, and ICSID, with its own Articles of Agreement, share capital, financial structure, management, and staff. Membership in IFC is open only to member countries of IBRD. IFC is not liable for the obligations of the other institutions.\nIFC's mission - as one of the WBG entities - is to end extreme poverty and boost shared prosperity on a livable planet. As the private sector arm of the WBG, IFC provides financing and advisory services to support private sector development in developing economies as a key engine of growth in line with good environmental, social and governance standards. To further support these efforts, the Board and Management have been working on evolving the WBG to better address the scale of development challenges. As part of this evolution, in October 2023, the Board of Governors endorsed the new vision and mission, as well as initiatives to increase impact, modernize the approach to delivery, and increase financing capacity. Since then, the WBG has started the implementation and operationalization of the evolution process to address countries' most pressing development challenges. IFC is at the forefront of these reforms in view of its private sector mandate to close the financing gap beyond what governments can provide alone to address global challenges. This includes piloting an originate to distribute approach, further identifying and addressing bottlenecks to private sector activities, while leveraging partnerships with other development financial institutions (DFIs) and multilateral development banks (MDBs) to scale impact - among others. Recently, IFC also supported the initiative to grant public access to the Global Emerging Markets (GEMs) default and recovery rates to enhance transparency, and help private sector investors boost confidence in emerging markets and make informed decisions."", ""er of complementary tools to crowd in private sector financing that would otherwise not be available to projects with high development impact. IFC blends concessional funds, typically from development partners, alongside IFC's own commercial funding.\nMobilization Products IFC promotes development by mobilizing financing for the private sector in its developing member countries. Mobilization at IFC is governed by IFC's Core Mobilization Procedure (the Procedure). The Procedure interprets how the harmonized MDB/DFI mobilization definitions of mobilization apply to IFC's private-sector development activities. IFC estimates Core Mobilization at the time of commitment based on the project financing plan. Mobilization activities are included in Core Mobilization if they meet five criteria:\nThe Procedure provides product-specific frameworks for interventions to qualify as Core Mobilization. These include:\nINVESTMENT PORTFOLIO MANAGEMENT"", 'alignment with Basel Framework and S&P rating methodology by deducting the pension surplus of each pension plan. Effective from Q4, IFC excluded the PCRF assets from Capital Available, aligning with its intended use for post-retirement contributions.\nSECTION II. OVERVIEW\nIFC is the largest global development institution focused on the private sector in developing countries. Established in 1956, IFC is owned by 186 member countries, a group that collectively determines its policies. IFC is a member of the WBG but is a legal entity separate and distinct from IBRD, IDA, MIGA, and ICSID, with its own Articles of Agreement, share capital, financial structure, management, and staff. Membership in IFC is open only to member countries of IBRD. IFC is not liable for the obligations of the other WBG institutions.\nFINANCIAL BUSINESS MODEL']","To modernize its framework, the organization (IFC, as part of the WBG evolution) is deploying several strategies:

*   **Increasing impact.**
*   **Modernizing the approach to delivery.**
*   **Increasing financing capacity.**
*   **Piloting an originate to distribute approach.**
*   **Further identifying and addressing bottlenecks to private sector activities.**
*   **Leveraging partnerships with other development financial institutions (DFIs) and multilateral development banks (MDBs) to scale impact.**
*   **Supporting the initiative to grant public access to the Global Emerging Markets (GEMs) default and recovery rates** to enhance transparency and help private sector investors boost confidence in emerging markets and make informed decisions.",The WBG is evolving to better address global development challenges by implementing initiatives to increase impact and modernize delivery.,0.9411764705882353,0.6884753386637384,0.49999999995,1.0
